{
  "$schema": "https://schemas.vik.guru/visual-fidelity-contracts/1.0.0/example-catalog.schema.json",
  "schemaVersion": "1.0.0",
  "libraryId": "visual-fidelity-pattern-library",
  "reviewedOn": "2026-10-20",
  "publicCollection": "https://kindlight.systems/visual-fidelity-contracts",
  "generation": {
    "command": "npm run build:visual-fidelity-pattern-library",
    "check": "npm run check:visual-fidelity-pattern-library",
    "widths": [
      640,
      1280,
      1600
    ]
  },
  "examples": [
    {
      "id": "vfp:industrial-ink:service-boundary",
      "slug": "industrial-ink-service-boundary",
      "ordinal": 1,
      "category": "industrial-ink",
      "title": "Industrial Ink service boundary",
      "description": "A technical workbench lets a reviewer follow one accepted task through authorization, processing, recovery, and a final human decision.",
      "alt": "Dark technical workbench with scenario controls, an accepted task record, and separate cards for request, authorization, transaction, receipt, cache, AI output, disclosure, and decision state.",
      "caption": "Figure 1. Industrial Ink gives dense service state a calm hierarchy while one accepted revision remains visible through replay, interruption, rollback, and recovery.",
      "source": {
        "path": "visual-fidelity-contracts/labs/service-boundary-lab/index.html",
        "selector": "main[data-service-boundary-lab]",
        "state": "success",
        "type": "runnable-lab",
        "identity": "service-boundary-lab@1.2.0",
        "files": [
          "visual-fidelity-contracts/labs/service-boundary-lab/index.html",
          "visual-fidelity-contracts/labs/service-boundary-lab/styles.css",
          "visual-fidelity-contracts/labs/service-boundary-lab/service-boundary-lab.js",
          "visual-fidelity-contracts/labs/service-boundary-lab/service-boundary-model.js"
        ]
      },
      "contract": {
        "id": "vfc:industrial-ink",
        "version": "1.0.0",
        "path": "visual-fidelity-contracts/contracts/industrial-ink/README.md",
        "publicRoute": "https://kindlight.systems/visual-fidelity-contracts/industrial-ink-visual-fidelity-contract"
      },
      "publicContinuation": "https://kindlight.systems/visual-fidelity-contracts/visual-fidelity-practitioner-probes-layered-judgment-evidence/visual-fidelity-probes-back-end-runtime-transactions-framework-boundaries",
      "semanticCompanion": {
        "summary": "The accepted task remains available while each boundary reports its own state and recovery route.",
        "relationships": [
          [
            "Accepted object",
            "Task T-204 at accepted revision 7"
          ],
          [
            "Candidate path",
            "Authorized command → transaction → receipt → outbox"
          ],
          [
            "Recovery",
            "Interrupt, checkpoint, resume, rollback, or retain the prior accepted revision"
          ],
          [
            "Decision authority",
            "A named human accepts a generated claim after its evidence label is visible"
          ]
        ],
        "path": "figures/industrial-ink-service-boundary.v1.json"
      },
      "tests": [
        "tests/visual-fidelity-contracts/service-boundary-model.test.mjs",
        "tests/visual-fidelity-contracts/service-boundary.browser.mjs"
      ],
      "rights": {
        "license": "Apache-2.0",
        "copyrightHoldersSource": "AUTHORS",
        "copyrightHolders": [
          "Vikrant Varun Kudesia",
          "Driftframe Studios, Limited Liability Company"
        ],
        "publisher": "Driftframe Studios, Limited Liability Company",
        "standing": "Documentation derivative of synthetic source maintained in this repository"
      },
      "publicationReceipt": {
        "sourceAuthority": "Declared repository source set",
        "publicationAuthority": {
          "standing": "held",
          "receiver": "Vikrant Varun Kudesia — named human publication receiver",
          "activationEvent": "Explicit human approval of the publication receiver"
        },
        "method": "Playwright Chromium element capture → Sharp WebP derivative",
        "reviewedOn": "2026-10-20",
        "sourceClosure": {
          "algorithm": "sha256",
          "files": [
            "visual-fidelity-contracts/labs/service-boundary-lab/index.html",
            "visual-fidelity-contracts/labs/service-boundary-lab/service-boundary-lab.js",
            "visual-fidelity-contracts/labs/service-boundary-lab/service-boundary-model.js",
            "visual-fidelity-contracts/labs/service-boundary-lab/styles.css"
          ],
          "sha256": "32c5485447e0a4cdec5b93cfd333050fb7edee73b740f8687a18b4b09ad364c0"
        },
        "metadataInspection": {
          "standing": "passed",
          "derivativeCount": 3,
          "fields": [
            "EXIF absent",
            "XMP absent",
            "IPTC absent",
            "orientation absent"
          ]
        },
        "locatorInspection": {
          "standing": "passed",
          "scope": "Declared source files, definitions, catalog, semantic companions, and gallery"
        },
        "secretInspection": {
          "standing": "passed",
          "method": "Bounded secret-shaped lexical admission scan",
          "scope": "Declared source files, definitions, catalog, semantic companions, and gallery"
        },
        "pixelInspection": {
          "standing": "reviewed",
          "reviewedOn": "2026-10-20",
          "derivativeSha256": "0791b9da373c22d871cbff5c33ae358f00e07ae7bb8cf95e3383d108e8bc4b69",
          "scope": "1600-pixel derivative inspected at original resolution"
        }
      },
      "responsiveImage": {
        "intrinsicWidth": 1600,
        "intrinsicHeight": 3083,
        "sizes": "(min-width: 72rem) 42rem, (min-width: 48rem) 82vw, 94vw",
        "derivatives": [
          {
            "path": "images/industrial-ink/industrial-ink-service-boundary-640.webp",
            "width": 640,
            "height": 1233,
            "format": "webp",
            "bytes": 63744,
            "sha256": "9c54786a691f067b14e10dda6d8ef05e3314cb9a4c02297708b1247e4da27a36",
            "metadata": {
              "exif": false,
              "xmp": false,
              "iptc": false,
              "orientation": null,
              "colorProfile": "sRGB encoder default"
            }
          },
          {
            "path": "images/industrial-ink/industrial-ink-service-boundary-1280.webp",
            "width": 1280,
            "height": 2467,
            "format": "webp",
            "bytes": 180856,
            "sha256": "b0857e67e063b32575cba2ba43534a2526447013ec421f1e555156a1cac93de7",
            "metadata": {
              "exif": false,
              "xmp": false,
              "iptc": false,
              "orientation": null,
              "colorProfile": "sRGB encoder default"
            }
          },
          {
            "path": "images/industrial-ink/industrial-ink-service-boundary-1600.webp",
            "width": 1600,
            "height": 3083,
            "format": "webp",
            "bytes": 237872,
            "sha256": "0791b9da373c22d871cbff5c33ae358f00e07ae7bb8cf95e3383d108e8bc4b69",
            "metadata": {
              "exif": false,
              "xmp": false,
              "iptc": false,
              "orientation": null,
              "colorProfile": "sRGB encoder default"
            }
          }
        ]
      }
    },
    {
      "id": "vfp:soft-color-blocking:workflow",
      "slug": "soft-color-blocking-workflow",
      "ordinal": 2,
      "category": "soft-color-blocking",
      "title": "Soft Color Blocking workflow",
      "description": "Broad fields give orientation, comparison, review, and recovery distinct places while labels carry the selected state and the next useful action.",
      "alt": "Warm pink and cream workflow with four square state blocks for Orient, Compare, Review, and Recover, followed by selected-state details and a state register.",
      "caption": "Figure 2. Soft Color Blocking makes a four-stage workflow approachable while written labels, geometry, and status text preserve its operating meaning.",
      "source": {
        "path": "visual-fidelity-contracts/contracts/soft-color-blocking/specimen.html",
        "selector": "main.shell",
        "state": "review",
        "type": "contract-specimen",
        "identity": "soft-color-blocking-specimen@1.0.0",
        "files": [
          "visual-fidelity-contracts/contracts/soft-color-blocking/specimen.html",
          "visual-fidelity-contracts/contracts/soft-color-blocking/tokens.css"
        ]
      },
      "contract": {
        "id": "vfc:soft-color-blocking",
        "version": "1.0.0",
        "path": "visual-fidelity-contracts/contracts/soft-color-blocking/README.md",
        "publicRoute": "https://kindlight.systems/visual-fidelity-contracts/soft-color-blocking-visual-fidelity-contract"
      },
      "publicContinuation": "https://kindlight.systems/visual-fidelity-contracts/soft-color-blocking-visual-fidelity-contract",
      "semanticCompanion": {
        "summary": "Four written workflow states lead to a selected detail and an explicit next action.",
        "relationships": [
          [
            "Sequence",
            "Orient → Compare → Review → Recover"
          ],
          [
            "Selected state",
            "Review is held with its object and next action visible"
          ],
          [
            "Redundant meaning",
            "Labels, source order, borders, and status text reinforce the color fields"
          ],
          [
            "Recovery",
            "The accepted revision and continuation action stay explicit"
          ]
        ],
        "path": "figures/soft-color-blocking-workflow.v1.json"
      },
      "tests": [
        "tests/visual-fidelity-contracts/contract-art-directions.test.mjs",